{
    "$schema": "http://json-schema.org/schema#",
    "type": "object",
    "properties": {
        "status": {
            "type": "string"
        },
        "policy": {
            "type": "object",
            "properties": {
                "name": {
                    "type": "string"
                },
                "description": {
                    "type": "string"
                }
            },
            "required": [
                "description",
                "name"
            ]
        },
        "findingKey": {
            "type": "string"
        },
        "findingId": {
            "type": "string"
        },
        "cloudGuardAccountId": {
            "type": "string"
        },
        "origin": {
            "type": "string"
        },
        "bundle": {
            "type": "object",
            "properties": {
                "name": {
                    "type": "string"
                },
                "description": {
                    "type": "string"
                },
                "id": {
                    "type": "integer"
                }
            },
            "required": [
                "description",
                "id",
                "name"
            ]
        },
        "reportTime": {
            "type": "string"
        },
        "rule": {
            "type": "object",
            "properties": {
                "name": {
                    "type": "string"
                },
                "ruleId": {
                    "type": "string"
                },
                "description": {
                    "type": "string"
                },
                "remediation": {
                    "type": "string"
                },
                "complianceTags": {
                    "type": "string"
                },
                "logicHash": {
                    "type": "string"
                },
                "severity": {
                    "type": "string"
                }
            },
            "required": [
                "complianceTags",
                "description",
                "logicHash",
                "name",
                "remediation",
                "ruleId",
                "severity"
            ]
        },
        "account": {
            "type": "object",
            "properties": {
                "id": {
                    "type": "string"
                },
                "name": {
                    "type": "string"
                },
                "vendor": {
                    "type": "string"
                },
                "dome9CloudAccountId": {
                    "type": "string"
                },
                "organizationalUnitId": {
                    "type": "string"
                },
                "organizationalUnitPath": {
                    "type": "string"
                }
            },
            "required": [
                "dome9CloudAccountId",
                "id",
                "name",
                "organizationalUnitId",
                "organizationalUnitPath",
                "vendor"
            ]
        },
        "region": {
            "type": "string"
        },
        "entity": {
            "type": "object",
            "properties": {
                "defaultServiceAccount": {
                    "type": "string"
                },
                "description": {
                    "type": "null"
                },
                "enabledFeatures": {
                    "type": "null"
                },
                "metadata": {
                    "type": "object",
                    "properties": {
                        "items": {
                            "type": "null"
                        },
                        "eTag": {
                            "type": "null"
                        },
                        "kind": {
                            "type": "string"
                        }
                    },
                    "required": [
                        "eTag",
                        "items",
                        "kind"
                    ]
                },
                "sharedVpcHostProjectId": {
                    "type": "null"
                },
                "enabledServices": {
                    "type": "array",
                    "items": {
                        "type": "object",
                        "properties": {
                            "name": {
                                "type": "string"
                            },
                            "title": {
                                "type": "string"
                            }
                        },
                        "required": [
                            "name",
                            "title"
                        ]
                    }
                },
                "projectNumber": {
                    "type": "string"
                },
                "lifecycleState": {
                    "type": "string"
                },
                "createTime": {
                    "type": "integer"
                },
                "labels": {
                    "type": "null"
                },
                "accessApprovalSettings": {
                    "type": "null"
                },
                "selfLink": {
                    "type": "string"
                },
                "id": {
                    "type": "string"
                },
                "type": {
                    "type": "string"
                },
                "name": {
                    "type": "string"
                },
                "dome9Id": {
                    "type": "string"
                },
                "accountNumber": {
                    "type": "string"
                },
                "assetLabels": {
                    "type": "null"
                },
                "region": {
                    "type": "string"
                },
                "externalFindings": {
                    "type": "null"
                }
            },
            "required": [
                "accessApprovalSettings",
                "accountNumber",
                "assetLabels",
                "createTime",
                "defaultServiceAccount",
                "description",
                "dome9Id",
                "enabledFeatures",
                "enabledServices",
                "externalFindings",
                "id",
                "labels",
                "lifecycleState",
                "metadata",
                "name",
                "projectNumber",
                "region",
                "selfLink",
                "sharedVpcHostProjectId",
                "type"
            ]
        },
        "remediationActions": {
            "type": "array"
        },
        "action": {
            "type": "string"
        },
        "additionalFields": {
            "type": "array"
        }
    },
    "required": [
        "account",
        "action",
        "additionalFields",
        "bundle",
        "cloudGuardAccountId",
        "entity",
        "findingId",
        "findingKey",
        "origin",
        "policy",
        "region",
        "remediationActions",
        "reportTime",
        "rule",
        "status"
    ]
}